{"dirty":false,"git_commit":"1111111111111111111111111111111111111111","git_tree":"2222222222222222222222222222222222222222","inputs":[{"digest":"sha256:0000000000000000000000000000000000000000000000000000000000000000","name":"candidate-identity-schema","path":"release/evidence/schemas/candidate-identity-v1.schema.json"},{"digest":"sha256:1111111111111111111111111111111111111111111111111111111111111111","name":"gate-record-schema","path":"release/evidence/schemas/gate-record-v1.schema.json"},{"digest":"sha256:2222222222222222222222222222222222222222222222222222222222222222","name":"package-metadata","path":"pyproject.toml"},{"digest":"sha256:3333333333333333333333333333333333333333333333333333333333333333","name":"package-version","path":"src/quarry_recon/__init__.py"},{"digest":"sha256:4444444444444444444444444444444444444444444444444444444444444444","name":"release-evidence-validator","path":"src/quarry_recon/release_evidence.py"},{"digest":"sha256:5555555555555555555555555555555555555555555555555555555555555555","name":"release-gate-contract","path":"docs/releases/RELEASE-GATES.md"},{"digest":"sha256:6666666666666666666666666666666666666666666666666666666666666666","name":"release-schema-registry","path":"release/evidence/registry-v1.json"},{"digest":"sha256:7777777777777777777777777777777777777777777777777777777777777777","name":"release-schema-registry-schema","path":"release/evidence/schemas/schema-registry-v1.schema.json"},{"digest":"sha256:8888888888888888888888888888888888888888888888888888888888888888","name":"release-scope-ledger","path":"docs/releases/v0.3.10.md"}],"package_version":"0.3.10","package_version_sources":[{"digest":"sha256:2222222222222222222222222222222222222222222222222222222222222222","path":"pyproject.toml","value":"0.3.10"},{"digest":"sha256:3333333333333333333333333333333333333333333333333333333333333333","path":"src/quarry_recon/__init__.py","value":"0.3.10"}],"release":"0.3.10","schema_version":"quarry.candidate-identity.v1","schema_versions":{"candidate_identity":"quarry.candidate-identity.v1","gate_record":"quarry.release-gate.v1","schema_registry":"quarry.release-schema-registry.v1"},"source_tree_digest":"sha256:eeeeeeeeeeeeeeeeeeeeeeeeeeeeeeeeeeeeeeeeeeeeeeeeeeeeeeeeeeeeeeee","source_tree_digest_algorithm":"quarry.git-tree-sha256.v1","submodules":[]}
